{
 "schemaVersion": 1,
 "id": "kukhnya-s02e17-scene-12",
 "pair": "ru-en",
 "show": "kukhnya",
 "season": 2,
 "episode": 17,
 "scene": 12,
 "title": "Признание Луи в кладовой  (Louis's Confession in the Storage Room)",
 "level": "A1 — Duolingo Section 2",
 "labels": {
  "louis": "Луи",
  "nastya": "Настя"
 },
 "segments": [
  {
   "v": "narrator",
   "t": "In the storage room, the persistent female guest corners Louis and says she missed him terribly. Louis awkwardly confesses that she was the very first girl he ever slept with and that they cannot be together, only for Chef Barinov to burst in reciting poetry.",
   "gap": 0.8
  },
  {
   "v": "nastya",
   "t": "Луи, извини, что я отвлекаю тебя от работы.",
   "gap": 0.55
  },
  {
   "v": "louis",
   "t": "Просто я очень соскучился.",
   "gap": 0.55
  },
  {
   "v": "nastya",
   "t": "Я так и знала.",
   "gap": 0.55
  },
  {
   "v": "louis",
   "t": "Нет, нет, нет.",
   "gap": 0.55
  },
  {
   "v": "nastya",
   "t": "Ты вообще единственная девушка, с которой я...",
   "gap": 0.55
  },
  {
   "v": "louis",
   "t": "Слава богу.",
   "gap": 0.55
  },
  {
   "v": "nastya",
   "t": "Поэтому между нами ничего не может быть.",
   "gap": 0.55
  },
  {
   "v": "louis",
   "t": "Я что, такая страшная?",
   "gap": 0.55
  },
  {
   "v": "nastya",
   "t": "Ты делал это как настоящий мужчина.",
   "gap": 0.55
  },
  {
   "v": "louis",
   "t": "Мальчик мой?",
   "gap": 0.55
  },
  {
   "v": "nastya",
   "t": "Ну-ка, живы на кухню.",
   "gap": 0.55
  },
  {
   "v": "louis",
   "t": "Мне очень скучно, нужно бежать.",
   "gap": 0.55
  },
  {
   "v": "nastya",
   "t": "Это он?",
   "gap": 0.9
  },
  {
   "v": "narrator",
   "t": "Let's replay the exchange and look closely at each Russian phrase.",
   "gap": 0.4
  },
  {
   "v": "nastya",
   "t": "Луи, извини, что я отвлекаю тебя от работы.",
   "gap": 0.55
  },
  {
   "v": "narrator",
   "t": "'Louis, forgive me for distracting you from your work.' Nastya reacts briskly facing Louis, bringing things back to earth after the buildup.",
   "gap": 0.4
  },
  {
   "v": "louis",
   "t": "Просто я очень соскучился.",
   "gap": 0.55
  },
  {
   "v": "narrator",
   "t": "'I just missed you so much.' Louis steps in decisively on the spot and brings in \"soskuchilsya\" (\"missed\", from \"soskuchitsya\") as the key Russian word here.",
   "gap": 0.4
  },
  {
   "v": "nastya",
   "t": "Я так и знала.",
   "gap": 0.55
  },
  {
   "v": "narrator",
   "t": "'I knew it all along.' Opening up dryly with Louis, spoken Russian compresses the whole thought into just 4 words, skipping the extra helper words English needs.",
   "gap": 0.4
  },
  {
   "v": "louis",
   "t": "Нет, нет, нет.",
   "gap": 0.55
  },
  {
   "v": "narrator",
   "t": "'No, no, no.' Louis responds candidly with a smile, without trying to dress up how he really feels.",
   "gap": 0.4
  },
  {
   "v": "nastya",
   "t": "Ты вообще единственная девушка, с которой я...",
   "gap": 0.55
  },
  {
   "v": "narrator",
   "t": "'You are actually the only girl I have ever...' Highlighting the girlfriend to Louis, Nastya leans on \"yedinstvennaya\" (\"only, sole\", a form of \"yedinstvennyy\") to give the remark its edge.",
   "gap": 0.4
  },
  {
   "v": "louis",
   "t": "Слава богу.",
   "gap": 0.55
  },
  {
   "v": "narrator",
   "t": "'Thank goodness for that.' Bringing up the glory before Nastya, spoken Russian compresses the whole thought into just 2 words, skipping the extra helper words English needs.",
   "gap": 0.4
  },
  {
   "v": "nastya",
   "t": "Поэтому между нами ничего не может быть.",
   "gap": 0.55
  },
  {
   "v": "narrator",
   "t": "'That is why nothing can ever happen between us.' Nastya answers decisively toward Louis, making her position completely clear.",
   "gap": 0.4
  },
  {
   "v": "louis",
   "t": "Я что, такая страшная?",
   "gap": 0.55
  },
  {
   "v": "narrator",
   "t": "'What, am I really that ugly?' Insisting on how terrible things are in front of Nastya, Louis puts the weight on \"strashnaya\" (\"terrible, dreadful\", from \"strashnyy\") as the exchange unfolds.",
   "gap": 0.4
  },
  {
   "v": "nastya",
   "t": "Ты делал это как настоящий мужчина.",
   "gap": 0.55
  },
  {
   "v": "narrator",
   "t": "'You did it like a real man.' Nastya replies plainly without any doubt, leaving no doubt about where she stands.",
   "gap": 0.4
  },
  {
   "v": "louis",
   "t": "Мальчик мой?",
   "gap": 0.55
  },
  {
   "v": "narrator",
   "t": "'My little boy?' Louis asks eagerly before Nastya can change the subject.",
   "gap": 0.4
  },
  {
   "v": "nastya",
   "t": "Ну-ка, живы на кухню.",
   "gap": 0.55
  },
  {
   "v": "narrator",
   "t": "'Alright, get back to the kitchen alive.' Underscoring the kitchen during the talk, Nastya leans on \"kukhnyu\" (\"kitchen\", a form of \"kukhnya\") to give the remark its edge.",
   "gap": 0.4
  },
  {
   "v": "louis",
   "t": "Мне очень скучно, нужно бежать.",
   "gap": 0.55
  },
  {
   "v": "narrator",
   "t": "'I am terribly sorry, I have to run.' Reacting candidly on the spot, Louis leans on \"nuzhno\" (\"it is needed, one has to\"), which carries the whole predicate in Russian without needing \"it is\".",
   "gap": 0.4
  },
  {
   "v": "nastya",
   "t": "Это он?",
   "gap": 0.55
  },
  {
   "v": "narrator",
   "t": "'Wait, is that him?' Nastya probes candidly before Louis can change the subject.",
   "gap": 0.9
  },
  {
   "v": "nastya",
   "t": "Луи, извини, что я отвлекаю тебя от работы.",
   "gap": 0.5
  },
  {
   "v": "louis",
   "t": "Просто я очень соскучился.",
   "gap": 0.5
  },
  {
   "v": "nastya",
   "t": "Я так и знала.",
   "gap": 0.5
  },
  {
   "v": "louis",
   "t": "Нет, нет, нет.",
   "gap": 0.5
  },
  {
   "v": "nastya",
   "t": "Ты вообще единственная девушка, с которой я...",
   "gap": 0.5
  },
  {
   "v": "louis",
   "t": "Слава богу.",
   "gap": 0.5
  },
  {
   "v": "nastya",
   "t": "Поэтому между нами ничего не может быть.",
   "gap": 0.5
  },
  {
   "v": "louis",
   "t": "Я что, такая страшная?",
   "gap": 0.5
  },
  {
   "v": "nastya",
   "t": "Ты делал это как настоящий мужчина.",
   "gap": 0.5
  },
  {
   "v": "louis",
   "t": "Мальчик мой?",
   "gap": 0.5
  },
  {
   "v": "nastya",
   "t": "Ну-ка, живы на кухню.",
   "gap": 0.5
  },
  {
   "v": "louis",
   "t": "Мне очень скучно, нужно бежать.",
   "gap": 0.5
  },
  {
   "v": "nastya",
   "t": "Это он?",
   "gap": 0.9
  },
  {
   "v": "narrator",
   "t": "That wraps up this scene as louis tries to tell his female admirer in the storage room that nothing can happen between them after their one night together, just as Chef Barinov barges in reciting poetry. See you next time!",
   "gap": 0.5
  },
  {
   "v": "nastya",
   "t": "Увидимся!",
   "gap": 0.3
  }
 ],
 "source": {
  "show": "Кухня (Kukhnya) S2.17",
  "file": "sources/kukhnya/s02/e17.ru.srt",
  "lines": [
   {
    "line": 0,
    "cue": 181,
    "fragment": "Луи, извини, что я отвлекаю тебя от работы"
   },
   {
    "line": 1,
    "cue": 182,
    "fragment": "Просто я очень соскучился"
   },
   {
    "line": 2,
    "cue": 184,
    "fragment": "Я так и знала"
   },
   {
    "line": 3,
    "cue": 185,
    "fragment": "Нет, нет, нет"
   },
   {
    "line": 4,
    "cue": 186,
    "fragment": "Ты вообще единственная девушка, с которой я"
   },
   {
    "line": 5,
    "cue": 188,
    "fragment": "Слава богу"
   },
   {
    "line": 6,
    "cue": 189,
    "fragment": "Поэтому между нами ничего не может быть"
   },
   {
    "line": 7,
    "cue": 190,
    "fragment": "Я что, такая страшная"
   },
   {
    "line": 8,
    "cue": 192,
    "fragment": "ты делал это как настоящий мужчина"
   },
   {
    "line": 9,
    "cue": 195,
    "fragment": "Мальчик мой"
   },
   {
    "line": 10,
    "cue": 196,
    "fragment": "Ну-ка, живы на кухню"
   },
   {
    "line": 11,
    "cue": 197,
    "fragment": "Мне очень скучно, нужно бежать"
   },
   {
    "line": 12,
    "cue": 198,
    "fragment": "Это он"
   }
  ]
 }
}
