{
 "schemaVersion": 1,
 "id": "kukhnya-s04e10-scene-02",
 "pair": "ru-en",
 "show": "kukhnya",
 "season": 4,
 "episode": 10,
 "scene": 2,
 "title": "Новое кино Нагиева  (Nagiyev's New Movie)",
 "level": "A1 — Duolingo Section 2",
 "labels": {
  "max": "Макс",
  "nagiyev": "Нагиев",
  "senya": "Сеня"
 },
 "segments": [
  {
   "v": "narrator",
   "t": "Dmitry Nagiyev proudly explains that the banquet is for the film crew of his new comedy, and the moment he leaves the kitchen, Senya begins roasting modern Russian cinema.",
   "gap": 0.8
  },
  {
   "v": "max",
   "t": "А что за банкет сегодня?",
   "gap": 0.55
  },
  {
   "v": "nagiyev",
   "t": "Кино со мной закончили снимать.",
   "gap": 0.55
  },
  {
   "v": "nagiyev",
   "t": "Я там в главной роли.",
   "gap": 0.55
  },
  {
   "v": "nagiyev",
   "t": "Комедия правда очень смешная.",
   "gap": 0.55
  },
  {
   "v": "nagiyev",
   "t": "Давайте не отвлекаемся от работы.",
   "gap": 0.55
  },
  {
   "v": "nagiyev",
   "t": "Салаты и закуски готовим быстро.",
   "gap": 0.55
  },
  {
   "v": "senya",
   "t": "Ну всё понятно с этим кино.",
   "gap": 0.55
  },
  {
   "v": "senya",
   "t": "Опять сняли какую-то ерунду.",
   "gap": 0.55
  },
  {
   "v": "senya",
   "t": "И она всю кассу соберёт.",
   "gap": 0.55
  },
  {
   "v": "max",
   "t": "Ещё кто-то так думает?",
   "gap": 0.55
  },
  {
   "v": "senya",
   "t": "Это кино окупается до выхода.",
   "gap": 0.55
  },
  {
   "v": "senya",
   "t": "Туда просто рекламу напихают.",
   "gap": 0.9
  },
  {
   "v": "narrator",
   "t": "Let's break down each line as Nagiyev brags and Senya critiques the film industry.",
   "gap": 0.4
  },
  {
   "v": "max",
   "t": "А что за банкет сегодня?",
   "gap": 0.55
  },
  {
   "v": "narrator",
   "t": "'And what kind of banquet is it today?' Asking whether what kind of banquet is it today puts Nagiyev right on the defensive. In Russian, he does not need helper words like \"do\" or \"did\"—rising pitch alone turns it into a question.",
   "gap": 0.4
  },
  {
   "v": "nagiyev",
   "t": "Кино со мной закончили снимать.",
   "gap": 0.55
  },
  {
   "v": "narrator",
   "t": "'They finished filming a movie with me.' Around the room and banquet, Nagiyev sets a calm, everyday tone with Max.",
   "gap": 0.4
  },
  {
   "v": "nagiyev",
   "t": "Я там в главной роли.",
   "gap": 0.55
  },
  {
   "v": "narrator",
   "t": "'I have the lead role in it.' Admitting that he has the lead role in it shows Nagiyev being honest for a change.",
   "gap": 0.4
  },
  {
   "v": "nagiyev",
   "t": "Комедия правда очень смешная.",
   "gap": 0.55
  },
  {
   "v": "narrator",
   "t": "'The comedy is truly very funny.' Nagiyev reminds Max that the comedy is truly very funny before the moment passes.",
   "gap": 0.4
  },
  {
   "v": "nagiyev",
   "t": "Давайте не отвлекаемся от работы.",
   "gap": 0.55
  },
  {
   "v": "narrator",
   "t": "'Let's not get distracted from work.' Realizing that they should not get distracted from work changes how Nagiyev handles the situation. Starting with \"davay\" is the everyday Russian way to say \"come on, let us do this\".",
   "gap": 0.4
  },
  {
   "v": "nagiyev",
   "t": "Салаты и закуски готовим быстро.",
   "gap": 0.55
  },
  {
   "v": "narrator",
   "t": "'We prepare the salads and appetizers quickly.' Here preparing the salads and appetizers quickly sets up the next turn in their exchange.",
   "gap": 0.4
  },
  {
   "v": "senya",
   "t": "Ну всё понятно с этим кино.",
   "gap": 0.55
  },
  {
   "v": "narrator",
   "t": "'Well, everything is clear with this movie.' Senya mentions that everything is clear with this movie so Max sees what is at stake.",
   "gap": 0.4
  },
  {
   "v": "senya",
   "t": "Опять сняли какую-то ерунду.",
   "gap": 0.55
  },
  {
   "v": "narrator",
   "t": "'They filmed some nonsense again.' With the banquet and moment in play, Senya keeps this short reply brisk and direct.",
   "gap": 0.4
  },
  {
   "v": "senya",
   "t": "И она всю кассу соберёт.",
   "gap": 0.55
  },
  {
   "v": "narrator",
   "t": "'And it will collect the whole box office.' Pointing out that it will collect the whole box office gives Max a sobering reality check.",
   "gap": 0.4
  },
  {
   "v": "max",
   "t": "Ещё кто-то так думает?",
   "gap": 0.55
  },
  {
   "v": "narrator",
   "t": "'Does anyone else think so?' Here asking whether anyone else think shows Max looking for the real truth. In Russian, he does not need helper words like \"do\" or \"did\"—rising pitch alone turns it into a question.",
   "gap": 0.4
  },
  {
   "v": "senya",
   "t": "Это кино окупается до выхода.",
   "gap": 0.55
  },
  {
   "v": "narrator",
   "t": "'This movie pays for itself before release.' Realizing that this movie pays for itself before release changes how Senya handles the situation. Russian drops \"is\" in the present, setting the two halves of the thought side by side.",
   "gap": 0.4
  },
  {
   "v": "senya",
   "t": "Туда просто рекламу напихают.",
   "gap": 0.55
  },
  {
   "v": "narrator",
   "t": "'They just cram commercials into it.' With the banquet and kitchen in play, Senya keeps this short reply brisk and direct. Now let's hear the whole conversation again from start to finish.",
   "gap": 0.9
  },
  {
   "v": "max",
   "t": "А что за банкет сегодня?",
   "gap": 0.5
  },
  {
   "v": "nagiyev",
   "t": "Кино со мной закончили снимать.",
   "gap": 0.5
  },
  {
   "v": "nagiyev",
   "t": "Я там в главной роли.",
   "gap": 0.5
  },
  {
   "v": "nagiyev",
   "t": "Комедия правда очень смешная.",
   "gap": 0.5
  },
  {
   "v": "nagiyev",
   "t": "Давайте не отвлекаемся от работы.",
   "gap": 0.5
  },
  {
   "v": "nagiyev",
   "t": "Салаты и закуски готовим быстро.",
   "gap": 0.5
  },
  {
   "v": "senya",
   "t": "Ну всё понятно с этим кино.",
   "gap": 0.5
  },
  {
   "v": "senya",
   "t": "Опять сняли какую-то ерунду.",
   "gap": 0.5
  },
  {
   "v": "senya",
   "t": "И она всю кассу соберёт.",
   "gap": 0.5
  },
  {
   "v": "max",
   "t": "Ещё кто-то так думает?",
   "gap": 0.5
  },
  {
   "v": "senya",
   "t": "Это кино окупается до выхода.",
   "gap": 0.5
  },
  {
   "v": "senya",
   "t": "Туда просто рекламу напихают.",
   "gap": 0.9
  },
  {
   "v": "narrator",
   "t": "Listen for how Russian uses the verb 'to photograph/take off' when talking about shooting a movie, and 'cash register' for the box office. See you next time!",
   "gap": 0.5
  },
  {
   "v": "nagiyev",
   "t": "Пока!",
   "gap": 0.3
  }
 ],
 "source": {
  "show": "Кухня (Kukhnya) S4.10",
  "file": "sources/kukhnya/s04/e10.ru.srt",
  "lines": [
   {
    "line": 0,
    "cue": 15,
    "fragment": "А что за банкет"
   },
   {
    "line": 1,
    "cue": 15,
    "fragment": "со мной закончили снимать"
   },
   {
    "line": 2,
    "cue": 15,
    "fragment": "в главной роли"
   },
   {
    "line": 3,
    "cue": 17,
    "fragment": "Правда смешная"
   },
   {
    "line": 4,
    "cue": 18,
    "fragment": "Давайте не отвлекаемся"
   },
   {
    "line": 5,
    "cue": 18,
    "fragment": "Салаты там, закуски"
   },
   {
    "line": 6,
    "cue": 20,
    "fragment": "Ну все понятно"
   },
   {
    "line": 7,
    "cue": 20,
    "fragment": "опять сняли"
   },
   {
    "line": 8,
    "cue": 20,
    "fragment": "всю кассу соберет"
   },
   {
    "line": 9,
    "cue": 22,
    "fragment": "Еще кто-то так думает"
   },
   {
    "line": 10,
    "cue": 23,
    "fragment": "кино окупается еще до выхода"
   },
   {
    "line": 11,
    "cue": 24,
    "fragment": "Рекламу понапихают"
   }
  ]
 }
}
