{
 "schemaVersion": 1,
 "id": "kukhnya-s02e10-scene-07",
 "pair": "ru-en",
 "show": "kukhnya",
 "season": 2,
 "episode": 10,
 "scene": 7,
 "title": "Заказ на черепаховый суп  (The Order for Turtle Soup)",
 "level": "A1 — Duolingo Section 2",
 "labels": {
  "nastya": "Настя",
  "vika": "Вика"
 },
 "segments": [
  {
   "v": "narrator",
   "t": "Convinced by Lyova's gruff impression of Chef Barinov, the assistant explains that her boss loves exotic cuisine and demands turtle soup for tomorrow's dinner. When Vika protests that Claude Monet is a French restaurant, the woman hands over a live turtle and warns that refusing will bring big trouble.",
   "gap": 0.8
  },
  {
   "v": "nastya",
   "t": "Да, меня предупреждали, что он не совсем нормальный.",
   "gap": 0.55
  },
  {
   "v": "vika",
   "t": "Да вот, редко бывает хорошее настроение.",
   "gap": 0.55
  },
  {
   "v": "nastya",
   "t": "Прям как мой босс.",
   "gap": 0.55
  },
  {
   "v": "vika",
   "t": "А может быть, вы все-таки со мной поговорите?",
   "gap": 0.55
  },
  {
   "v": "nastya",
   "t": "Мой босс большой любитель экзотической кухни.",
   "gap": 0.55
  },
  {
   "v": "vika",
   "t": "Понимаете, у нас нет в меню черепахового супа.",
   "gap": 0.55
  },
  {
   "v": "nastya",
   "t": "У нас французский ресторан.",
   "gap": 0.55
  },
  {
   "v": "vika",
   "t": "Мы позаботились об этом.",
   "gap": 0.55
  },
  {
   "v": "nastya",
   "t": "Я понимаю.",
   "gap": 0.55
  },
  {
   "v": "vika",
   "t": "Дело в том.",
   "gap": 0.55
  },
  {
   "v": "nastya",
   "t": "Подумайте хорошенько.",
   "gap": 0.55
  },
  {
   "v": "vika",
   "t": "Чаевые, либо большие проблемы.",
   "gap": 0.55
  },
  {
   "v": "nastya",
   "t": "Ну, что-нибудь придумай.",
   "gap": 0.9
  },
  {
   "v": "narrator",
   "t": "Let's replay the exchange and look closely at each Russian phrase.",
   "gap": 0.4
  },
  {
   "v": "nastya",
   "t": "Да, меня предупреждали, что он не совсем нормальный.",
   "gap": 0.55
  },
  {
   "v": "narrator",
   "t": "'Yes, I was warned that he is not entirely normal.' Nastya adopts a natural bearing straight away, weaving \"preduprezhdali\" (\"to warn\") together with \"sovsem\" (\"at all\") just the way native speakers do.",
   "gap": 0.4
  },
  {
   "v": "vika",
   "t": "Да вот, редко бывает хорошее настроение.",
   "gap": 0.55
  },
  {
   "v": "narrator",
   "t": "'Indeed, he is rarely in a good mood.' Vika displays a lively manner on the spot, building the phrase around \"redko\" (\"rarely\") and \"byvayet\" (\"there can be\") for a crisp, natural delivery.",
   "gap": 0.4
  },
  {
   "v": "nastya",
   "t": "Прям как мой босс.",
   "gap": 0.55
  },
  {
   "v": "narrator",
   "t": "'Just like my boss.' Nastya sustains a steady bearing in the room, using \"pryam\" (from \"pryamo\", \"right, really\") alongside \"kak\" (\"how\") to shape the meaning.",
   "gap": 0.4
  },
  {
   "v": "vika",
   "t": "А может быть, вы все-таки со мной поговорите?",
   "gap": 0.55
  },
  {
   "v": "narrator",
   "t": "'Could you perhaps speak with me after all?' Vika checks warmly toward Nastya here, using \"mozhet\" (from \"moch\", \"can\") alongside \"byt\" (\"be\") to shape the meaning.",
   "gap": 0.4
  },
  {
   "v": "nastya",
   "t": "Мой босс большой любитель экзотической кухни.",
   "gap": 0.55
  },
  {
   "v": "narrator",
   "t": "'My boss is a huge fan of exotic cuisine.' Nastya offers a playful posture across the room, combining \"boss\" (\"boss\") and \"bolshoy\" (\"big\") so the key meaning lands right away.",
   "gap": 0.4
  },
  {
   "v": "vika",
   "t": "Понимаете, у нас нет в меню черепахового супа.",
   "gap": 0.55
  },
  {
   "v": "narrator",
   "t": "'You see, we do not have turtle soup on our menu.' Vika conveys a measured direction in the room, pairing \"ponimayete\" (\"do you understand\") with \"menyu\" (\"menu\") to get the point across in plain spoken Russian.",
   "gap": 0.4
  },
  {
   "v": "nastya",
   "t": "У нас французский ресторан.",
   "gap": 0.55
  },
  {
   "v": "narrator",
   "t": "'We are a French restaurant.' Nastya takes a serious tack in their talk, linking \"frantsuzskiy\" (\"French\"), \"restoran\" (\"restaurant\"), and \"nas\" (\"us\") in one brisk exchange.",
   "gap": 0.4
  },
  {
   "v": "vika",
   "t": "Мы позаботились об этом.",
   "gap": 0.55
  },
  {
   "v": "narrator",
   "t": "'We already took care of that.' Vika offers a direct position across the room, linking \"pozabotilis\" (\"to take care of\"), \"my\" (\"we\"), and \"ob\" (\"about\") in one brisk exchange.",
   "gap": 0.4
  },
  {
   "v": "nastya",
   "t": "Я понимаю.",
   "gap": 0.55
  },
  {
   "v": "narrator",
   "t": "'I understand.' Nastya projects a brisk note right away, building the phrase around \"ponimayu\" (\"understand\") and \"ya\" (\"I\") for a crisp, natural delivery.",
   "gap": 0.4
  },
  {
   "v": "vika",
   "t": "Дело в том.",
   "gap": 0.55
  },
  {
   "v": "narrator",
   "t": "'The thing is.' Vika conveys a brisk tone in the scene, putting \"delo\" (\"matter\") alongside \"tom\" (\"that\") in a tight, everyday turn of phrase.",
   "gap": 0.4
  },
  {
   "v": "nastya",
   "t": "Подумайте хорошенько.",
   "gap": 0.55
  },
  {
   "v": "narrator",
   "t": "'Think about it very carefully.' Nastya conveys a thoughtful angle straight away, using \"podumayte\" (from \"podumat\", \"think\") alongside \"khoroshenko\" (\"properly, thoroughly\") to shape the meaning.",
   "gap": 0.4
  },
  {
   "v": "vika",
   "t": "Чаевые, либо большие проблемы.",
   "gap": 0.55
  },
  {
   "v": "narrator",
   "t": "'Either a generous tip, or big problems.' Vika sets a thoughtful posture beside Nastya, putting \"chayevyye\" (\"tips\") alongside \"bolshiye\" (\"big, serious\") in a tight, everyday turn of phrase.",
   "gap": 0.4
  },
  {
   "v": "nastya",
   "t": "Ну, что-нибудь придумай.",
   "gap": 0.55
  },
  {
   "v": "narrator",
   "t": "'Well, figure something out.' Nastya picks a thoughtful line for Vika, combining \"pridumay\" (\"think up, figure out\") and \"nu\" (\"oh, come on\") so the key meaning lands right away.",
   "gap": 0.9
  },
  {
   "v": "nastya",
   "t": "Да, меня предупреждали, что он не совсем нормальный.",
   "gap": 0.5
  },
  {
   "v": "vika",
   "t": "Да вот, редко бывает хорошее настроение.",
   "gap": 0.5
  },
  {
   "v": "nastya",
   "t": "Прям как мой босс.",
   "gap": 0.5
  },
  {
   "v": "vika",
   "t": "А может быть, вы все-таки со мной поговорите?",
   "gap": 0.5
  },
  {
   "v": "nastya",
   "t": "Мой босс большой любитель экзотической кухни.",
   "gap": 0.5
  },
  {
   "v": "vika",
   "t": "Понимаете, у нас нет в меню черепахового супа.",
   "gap": 0.5
  },
  {
   "v": "nastya",
   "t": "У нас французский ресторан.",
   "gap": 0.5
  },
  {
   "v": "vika",
   "t": "Мы позаботились об этом.",
   "gap": 0.5
  },
  {
   "v": "nastya",
   "t": "Я понимаю.",
   "gap": 0.5
  },
  {
   "v": "vika",
   "t": "Дело в том.",
   "gap": 0.5
  },
  {
   "v": "nastya",
   "t": "Подумайте хорошенько.",
   "gap": 0.5
  },
  {
   "v": "vika",
   "t": "Чаевые, либо большие проблемы.",
   "gap": 0.5
  },
  {
   "v": "nastya",
   "t": "Ну, что-нибудь придумай.",
   "gap": 0.9
  },
  {
   "v": "narrator",
   "t": "That wraps up this scene as impressed by Lyova's grumpy act, the assistant hands over a live turtle and demands that the kitchen prepare exotic turtle soup for her boss tomorrow. Until next time!",
   "gap": 0.5
  },
  {
   "v": "nastya",
   "t": "Всего хорошего!",
   "gap": 0.3
  }
 ],
 "source": {
  "show": "Кухня (Kukhnya) S2.10",
  "file": "sources/kukhnya/s02/e10.ru.srt",
  "lines": [
   {
    "line": 0,
    "cue": 101,
    "fragment": "Да, меня предупреждали, что он не совсем нормальный"
   },
   {
    "line": 1,
    "cue": 102,
    "fragment": "Да вот, редко бывает хорошее настроение"
   },
   {
    "line": 2,
    "cue": 103,
    "fragment": "Прям как мой босс"
   },
   {
    "line": 3,
    "cue": 103,
    "fragment": "А может быть, вы все-таки со мной поговорите"
   },
   {
    "line": 4,
    "cue": 105,
    "fragment": "Мой босс большой любитель экзотической кухни"
   },
   {
    "line": 5,
    "cue": 107,
    "fragment": "Понимаете, у нас нет в меню черепахового супа"
   },
   {
    "line": 6,
    "cue": 108,
    "fragment": "У нас французский ресторан"
   },
   {
    "line": 7,
    "cue": 109,
    "fragment": "Мы позаботились об этом"
   },
   {
    "line": 8,
    "cue": 109,
    "fragment": "Я понимаю"
   },
   {
    "line": 9,
    "cue": 111,
    "fragment": "Дело в том"
   },
   {
    "line": 10,
    "cue": 112,
    "fragment": "Подумайте хорошенько"
   },
   {
    "line": 11,
    "cue": 114,
    "fragment": "чаевые, либо большие проблемы"
   },
   {
    "line": 12,
    "cue": 116,
    "fragment": "Ну, что-нибудь придумай"
   }
  ]
 }
}
