{
 "schemaVersion": 1,
 "id": "kukhnya-s05e07-scene-18",
 "pair": "ru-en",
 "show": "kukhnya",
 "season": 5,
 "episode": 7,
 "scene": 18,
 "title": "Ультиматум Вики  (Vika's Ultimatum)",
 "level": "A1 — Duolingo Section 2",
 "labels": {
  "max": "Макс",
  "vika": "Вика"
 },
 "segments": [
  {
   "v": "narrator",
   "t": "In the corridor, Vika confronts Max and demands that he leave both the restaurant and her life. When Max refuses to budge, she marches toward Chef Barinov's office with an ultimatum.",
   "gap": 0.8
  },
  {
   "v": "vika",
   "t": "Я хочу, чтобы ты ушёл.",
   "gap": 0.55
  },
  {
   "v": "max",
   "t": "Из ресторана?",
   "gap": 0.55
  },
  {
   "v": "vika",
   "t": "Из моей жизни.",
   "gap": 0.55
  },
  {
   "v": "max",
   "t": "А что, если я этого не хочу?",
   "gap": 0.55
  },
  {
   "v": "max",
   "t": "Ребёнку нужен отец.",
   "gap": 0.55
  },
  {
   "v": "vika",
   "t": "Нужен.",
   "gap": 0.55
  },
  {
   "v": "vika",
   "t": "Но не ты.",
   "gap": 0.55
  },
  {
   "v": "max",
   "t": "Вика, я всё равно никуда не уйду.",
   "gap": 0.55
  },
  {
   "v": "vika",
   "t": "В таком случае я сейчас пойду к Вите.",
   "gap": 0.55
  },
  {
   "v": "vika",
   "t": "И потребую, чтобы он тебя уволил.",
   "gap": 0.55
  },
  {
   "v": "vika",
   "t": "Если не уволят, уволюсь сама.",
   "gap": 0.55
  },
  {
   "v": "max",
   "t": "Вика, подожди, не делай глупостей.",
   "gap": 0.9
  },
  {
   "v": "narrator",
   "t": "Now let's go back through their conversation line by line and unpack the Russian phrasing.",
   "gap": 0.4
  },
  {
   "v": "vika",
   "t": "Я хочу, чтобы ты ушёл.",
   "gap": 0.55
  },
  {
   "v": "narrator",
   "t": "'I want you to leave.' Vika replies wryly with Max, leaving no doubt about where she stands.",
   "gap": 0.4
  },
  {
   "v": "max",
   "t": "Из ресторана?",
   "gap": 0.55
  },
  {
   "v": "narrator",
   "t": "'From the restaurant?' Mentioning the restaurant in front of Vika, Max centers the thought on \"restorana\" (\"restaurant\", from \"restoran\") without wasting a word.",
   "gap": 0.4
  },
  {
   "v": "vika",
   "t": "Из моей жизни.",
   "gap": 0.55
  },
  {
   "v": "narrator",
   "t": "'From my life.' Pointing to her life in this beat, spoken Russian compresses the whole thought into just 3 words, skipping the extra helper words English needs.",
   "gap": 0.4
  },
  {
   "v": "max",
   "t": "А что, если я этого не хочу?",
   "gap": 0.55
  },
  {
   "v": "narrator",
   "t": "'And what if I do not want that?' Max challenges evenly what Vika is actually getting at here.",
   "gap": 0.4
  },
  {
   "v": "max",
   "t": "Ребёнку нужен отец.",
   "gap": 0.55
  },
  {
   "v": "narrator",
   "t": "'The child needs a father.' Mentioning the child with Vika, Max chooses \"rebyonku\" (\"your child\", from the root \"rebyonok\") so Vika hears the exact meaning.",
   "gap": 0.4
  },
  {
   "v": "vika",
   "t": "Нужен.",
   "gap": 0.55
  },
  {
   "v": "narrator",
   "t": "'He does need one.' Replying firmly right here, spoken Russian compresses the whole thought into just 1 words, skipping the extra helper words English needs.",
   "gap": 0.4
  },
  {
   "v": "vika",
   "t": "Но не ты.",
   "gap": 0.55
  },
  {
   "v": "narrator",
   "t": "'But not you.' Vika proceeds steadily beside Max, watching Max's face to see how the news lands.",
   "gap": 0.4
  },
  {
   "v": "max",
   "t": "Вика, я всё равно никуда не уйду.",
   "gap": 0.55
  },
  {
   "v": "narrator",
   "t": "'Vika, I am not going anywhere anyway.' Max reacts frankly at once and leans on \"nikuda\" (\"nowhere, anywhere\") to give the whole sentence its punch.",
   "gap": 0.4
  },
  {
   "v": "vika",
   "t": "В таком случае я сейчас пойду к Вите.",
   "gap": 0.55
  },
  {
   "v": "narrator",
   "t": "'In that case, I will go to Vitya right now.' Highlighting the case at once, Vika puts the weight on \"sluchaye\" (\"case, event\", from \"sluchay\") as the exchange unfolds.",
   "gap": 0.4
  },
  {
   "v": "vika",
   "t": "И потребую, чтобы он тебя уволил.",
   "gap": 0.55
  },
  {
   "v": "narrator",
   "t": "'And demand that he fire you.' Vika speaks up promptly in their talk, keeping the focus on what actually matters here.",
   "gap": 0.4
  },
  {
   "v": "vika",
   "t": "Если не уволят, уволюсь сама.",
   "gap": 0.55
  },
  {
   "v": "narrator",
   "t": "'If they do not fire you, I will quit myself.' Vika continues earnestly during the talk and puts the weight on \"uvolyat\" (\"will fire\", from \"uvolit\") as the exchange unfolds.",
   "gap": 0.4
  },
  {
   "v": "max",
   "t": "Вика, подожди, не делай глупостей.",
   "gap": 0.55
  },
  {
   "v": "narrator",
   "t": "'Vika, wait, do not do anything foolish.' Highlighting the foolish in this beat, Max leans on \"glupostey\" (\"foolish things\", a form of \"glupost\") to give the remark its edge.",
   "gap": 0.9
  },
  {
   "v": "vika",
   "t": "Я хочу, чтобы ты ушёл.",
   "gap": 0.5
  },
  {
   "v": "max",
   "t": "Из ресторана?",
   "gap": 0.5
  },
  {
   "v": "vika",
   "t": "Из моей жизни.",
   "gap": 0.5
  },
  {
   "v": "max",
   "t": "А что, если я этого не хочу?",
   "gap": 0.5
  },
  {
   "v": "max",
   "t": "Ребёнку нужен отец.",
   "gap": 0.5
  },
  {
   "v": "vika",
   "t": "Нужен.",
   "gap": 0.5
  },
  {
   "v": "vika",
   "t": "Но не ты.",
   "gap": 0.5
  },
  {
   "v": "max",
   "t": "Вика, я всё равно никуда не уйду.",
   "gap": 0.5
  },
  {
   "v": "vika",
   "t": "В таком случае я сейчас пойду к Вите.",
   "gap": 0.5
  },
  {
   "v": "vika",
   "t": "И потребую, чтобы он тебя уволил.",
   "gap": 0.5
  },
  {
   "v": "vika",
   "t": "Если не уволят, уволюсь сама.",
   "gap": 0.5
  },
  {
   "v": "max",
   "t": "Вика, подожди, не делай глупостей.",
   "gap": 0.9
  },
  {
   "v": "narrator",
   "t": "Determined to carry out her threat, Vika heads straight into Barinov's office while a football match is on. See you next time!",
   "gap": 0.5
  },
  {
   "v": "max",
   "t": "Хорошего дня!",
   "gap": 0.3
  }
 ],
 "source": {
  "show": "Кухня (Kukhnya) S5.07",
  "file": "sources/kukhnya/s05/e07.ru.srt",
  "lines": [
   {
    "line": 0,
    "cue": 295,
    "fragment": "Я хочу, чтобы ты ушел"
   },
   {
    "line": 1,
    "cue": 296,
    "fragment": "Из ресторана"
   },
   {
    "line": 2,
    "cue": 296,
    "fragment": "Из моей жизни"
   },
   {
    "line": 3,
    "cue": 297,
    "fragment": "А что, если я этого не хочу"
   },
   {
    "line": 4,
    "cue": 298,
    "fragment": "Ребенку нужен отец"
   },
   {
    "line": 5,
    "cue": 299,
    "fragment": "Нужен"
   },
   {
    "line": 6,
    "cue": 300,
    "fragment": "Но не ты"
   },
   {
    "line": 7,
    "cue": 301,
    "fragment": "я все равно никуда не уйду"
   },
   {
    "line": 8,
    "cue": 302,
    "fragment": "В таком случае я сейчас пойду к Вите"
   },
   {
    "line": 9,
    "cue": 302,
    "fragment": "и потребую, чтобы он тебя уволил"
   },
   {
    "line": 10,
    "cue": 303,
    "fragment": "Если не уволят, уволюсь сама"
   },
   {
    "line": 11,
    "cue": 301,
    "fragment": "никуда не уйду"
   }
  ]
 }
}
