{
 "schemaVersion": 1,
 "id": "kukhnya-s01e17-scene-10",
 "pair": "ru-en",
 "show": "kukhnya",
 "season": 1,
 "episode": 17,
 "scene": 10,
 "title": "Котлеты со спаржей  (Chops with Asparagus)",
 "level": "A1 — Duolingo Section 2",
 "labels": {
  "fedya": "Федя",
  "senya": "Сеня"
 },
 "segments": [
  {
   "v": "narrator",
   "t": "After Chef Barinov leaves the kitchen without tasting the other dishes, Fedya stands holding his plate of lamb chops. He complains to Senya that his own creation never even got a fair chance in the contest. Let's listen to their conversation in Russian first.",
   "gap": 0.8
  },
  {
   "v": "fedya",
   "t": "Вот мои вкусные котлеты для шефа.",
   "gap": 0.55
  },
  {
   "v": "senya",
   "t": "Шеф уже выбрал моё мясное блюдо.",
   "gap": 0.55
  },
  {
   "v": "fedya",
   "t": "Он даже не попробовал мою еду!",
   "gap": 0.55
  },
  {
   "v": "senya",
   "t": "Потому что мой рецепт самый лучший.",
   "gap": 0.55
  },
  {
   "v": "fedya",
   "t": "Я готовил эти котлеты всё утро.",
   "gap": 0.55
  },
  {
   "v": "senya",
   "t": "Не надо так сильно расстраиваться, друг.",
   "gap": 0.55
  },
  {
   "v": "fedya",
   "t": "Ты просто был первый в очереди.",
   "gap": 0.55
  },
  {
   "v": "senya",
   "t": "В следующий раз ты точно победишь.",
   "gap": 0.55
  },
  {
   "v": "fedya",
   "t": "Хочешь попробовать мои новые котлеты?",
   "gap": 0.55
  },
  {
   "v": "senya",
   "t": "Давай, я с удовольствием попробую.",
   "gap": 0.55
  },
  {
   "v": "fedya",
   "t": "Ну как тебе вкус, скажи честно?",
   "gap": 0.55
  },
  {
   "v": "senya",
   "t": "Слушай, это действительно очень вкусно!",
   "gap": 0.55
  },
  {
   "v": "fedya",
   "t": "Тогда мы сами съедим это на обед.",
   "gap": 0.9
  },
  {
   "v": "narrator",
   "t": "Now let's examine this conversation line by line.",
   "gap": 0.4
  },
  {
   "v": "fedya",
   "t": "Вот мои вкусные котлеты для шефа.",
   "gap": 0.55
  },
  {
   "v": "narrator",
   "t": "'Here are my tasty chops for the Chef.' Russian omits the present-tense verb 'to be' here, linking 'tasty' directly with 'cutlets', followed by 'chef'.",
   "gap": 0.4
  },
  {
   "v": "senya",
   "t": "Шеф уже выбрал моё мясное блюдо.",
   "gap": 0.55
  },
  {
   "v": "narrator",
   "t": "'The Chef already chose my meat dish.' Here Senya anchors the line on the word meaning 'already' and builds the thought around 'chose' and 'meat'.",
   "gap": 0.4
  },
  {
   "v": "fedya",
   "t": "Он даже не попробовал мою еду!",
   "gap": 0.55
  },
  {
   "v": "narrator",
   "t": "'He did not even taste my food!' Fedya uses the action verb meaning 'tried' to focus on the single completed result, pairing it with 'am driving'.",
   "gap": 0.4
  },
  {
   "v": "senya",
   "t": "Потому что мой рецепт самый лучший.",
   "gap": 0.55
  },
  {
   "v": "narrator",
   "t": "'Because my recipe is the very best.' Russian omits the present-tense verb 'to be' here, linking 'because' directly with 'recipe', pairing it with 'the most' and 'best'.",
   "gap": 0.4
  },
  {
   "v": "fedya",
   "t": "Я готовил эти котлеты всё утро.",
   "gap": 0.55
  },
  {
   "v": "narrator",
   "t": "'I cooked these chops all morning.' Notice how naturally this everyday Russian phrase expresses the speaker's point.",
   "gap": 0.4
  },
  {
   "v": "senya",
   "t": "Не надо так сильно расстраиваться, друг.",
   "gap": 0.55
  },
  {
   "v": "narrator",
   "t": "'Do not be so upset, friend.' Here Senya anchors the line on the word meaning 'it is necessary' and builds the thought around 'strongly' and 'to get upset'.",
   "gap": 0.4
  },
  {
   "v": "fedya",
   "t": "Ты просто был первый в очереди.",
   "gap": 0.55
  },
  {
   "v": "narrator",
   "t": "'You were simply first in line.' The phrasing opens with 'just' before bringing in 'was' and 'first' to make the point clear.",
   "gap": 0.4
  },
  {
   "v": "senya",
   "t": "В следующий раз ты точно победишь.",
   "gap": 0.55
  },
  {
   "v": "narrator",
   "t": "'Next time you will definitely win.' Senya expresses this naturally by combining the word for 'next' with 'time' and 'definitely'.",
   "gap": 0.4
  },
  {
   "v": "fedya",
   "t": "Хочешь попробовать мои новые котлеты?",
   "gap": 0.55
  },
  {
   "v": "narrator",
   "t": "'Do you want to try my new chops?' Fedya turns a statement into a question purely through rising intonation on the word meaning 'do you want', pairing it with 'to taste' and 'new'.",
   "gap": 0.4
  },
  {
   "v": "senya",
   "t": "Давай, я с удовольствием попробую.",
   "gap": 0.55
  },
  {
   "v": "narrator",
   "t": "'Go ahead, I will gladly try them.' Senya leads with the direct command form meaning 'let's', pairing it with 'pleasure' and 'will try'.",
   "gap": 0.4
  },
  {
   "v": "fedya",
   "t": "Ну как тебе вкус, скажи честно?",
   "gap": 0.55
  },
  {
   "v": "narrator",
   "t": "'Well how is the taste to you, tell me honestly?' Fedya leads with the direct command form meaning 'say', pairing it with 'how' and 'taste'.",
   "gap": 0.4
  },
  {
   "v": "senya",
   "t": "Слушай, это действительно очень вкусно!",
   "gap": 0.55
  },
  {
   "v": "narrator",
   "t": "'Listen, this is really very tasty!' Senya leads with the direct command form meaning 'listen', pairing it with 'really' and 'very much'.",
   "gap": 0.4
  },
  {
   "v": "fedya",
   "t": "Тогда мы сами съедим это на обед.",
   "gap": 0.55
  },
  {
   "v": "narrator",
   "t": "'Then we will eat this ourselves for lunch.' Fedya puts the word for 'back then' together with 'to eat' and 'lunch' in a crisp, natural spoken turn of phrase. Now let's listen to the whole conversation again from start to finish.",
   "gap": 0.9
  },
  {
   "v": "fedya",
   "t": "Вот мои вкусные котлеты для шефа.",
   "gap": 0.5
  },
  {
   "v": "senya",
   "t": "Шеф уже выбрал моё мясное блюдо.",
   "gap": 0.5
  },
  {
   "v": "fedya",
   "t": "Он даже не попробовал мою еду!",
   "gap": 0.5
  },
  {
   "v": "senya",
   "t": "Потому что мой рецепт самый лучший.",
   "gap": 0.5
  },
  {
   "v": "fedya",
   "t": "Я готовил эти котлеты всё утро.",
   "gap": 0.5
  },
  {
   "v": "senya",
   "t": "Не надо так сильно расстраиваться, друг.",
   "gap": 0.5
  },
  {
   "v": "fedya",
   "t": "Ты просто был первый в очереди.",
   "gap": 0.5
  },
  {
   "v": "senya",
   "t": "В следующий раз ты точно победишь.",
   "gap": 0.5
  },
  {
   "v": "fedya",
   "t": "Хочешь попробовать мои новые котлеты?",
   "gap": 0.5
  },
  {
   "v": "senya",
   "t": "Давай, я с удовольствием попробую.",
   "gap": 0.5
  },
  {
   "v": "fedya",
   "t": "Ну как тебе вкус, скажи честно?",
   "gap": 0.5
  },
  {
   "v": "senya",
   "t": "Слушай, это действительно очень вкусно!",
   "gap": 0.5
  },
  {
   "v": "fedya",
   "t": "Тогда мы сами съедим это на обед.",
   "gap": 0.9
  },
  {
   "v": "narrator",
   "t": "Rather than letting the Breton lamb chops go to waste, the two friends decide to enjoy the gourmet meal together for their own lunch. Next time you watch the episode, listen for the Russian expressions for 'tasty' and 'cutlet' — you will catch every word right away. See you next time!",
   "gap": 0.5
  },
  {
   "v": "senya",
   "t": "Пока!",
   "gap": 0.3
  }
 ],
 "source": {
  "show": "Кухня (Kukhnya) S1.17",
  "file": "sources/kukhnya/s01/e17.ru.dual.srt",
  "lines": [
   {
    "line": 0,
    "cue": 134,
    "fragment": "котлеты"
   }
  ]
 }
}
