{
 "schemaVersion": 1,
 "id": "kukhnya-s02e05-scene-06",
 "pair": "ru-en",
 "show": "kukhnya",
 "season": 2,
 "episode": 5,
 "scene": 6,
 "title": "Соболезнования Косте  (Condolences to Kostya)",
 "level": "A1 — Duolingo Section 2",
 "labels": {
  "kostya": "Костя",
  "vika": "Вика"
 },
 "segments": [
  {
   "v": "narrator",
   "t": "At the bar, Vika sympathetically offers her condolences to Kostya over his grandfather, leaving Kostya completely baffled until he plays along and excuses himself. Touched by Max's apparent loyalty to his friend, Vika approaches Max and tells him she is ready to start fresh with him.",
   "gap": 0.8
  },
  {
   "v": "vika",
   "t": "А с чем?",
   "gap": 0.55
  },
  {
   "v": "kostya",
   "t": "Но у тебя же дедушка умер.",
   "gap": 0.55
  },
  {
   "v": "vika",
   "t": "Да, знаете, я.",
   "gap": 0.55
  },
  {
   "v": "kostya",
   "t": "Просто не до конца осознал.",
   "gap": 0.55
  },
  {
   "v": "vika",
   "t": "Позвольте, я все-таки вернусь к работе.",
   "gap": 0.55
  },
  {
   "v": "kostya",
   "t": "Да, да, да, конечно.",
   "gap": 0.55
  },
  {
   "v": "vika",
   "t": "Работай, Костя.",
   "gap": 0.55
  },
  {
   "v": "kostya",
   "t": "Но сейчас я точно знаю, что мне нужно.",
   "gap": 0.55
  },
  {
   "v": "vika",
   "t": "Давай начнем все сначала.",
   "gap": 0.55
  },
  {
   "v": "kostya",
   "t": "Вот это я понимаю.",
   "gap": 0.55
  },
  {
   "v": "vika",
   "t": "А ты не мог что-нибудь нормальное придумать?",
   "gap": 0.55
  },
  {
   "v": "kostya",
   "t": "Нашел на чем шутить.",
   "gap": 0.55
  },
  {
   "v": "vika",
   "t": "Главное, что все нормально прошло.",
   "gap": 0.9
  },
  {
   "v": "narrator",
   "t": "Let's replay the exchange and look closely at each Russian phrase.",
   "gap": 0.4
  },
  {
   "v": "vika",
   "t": "А с чем?",
   "gap": 0.55
  },
  {
   "v": "narrator",
   "t": "'With what?' Vika challenges firmly if there is more going on behind the scenes.",
   "gap": 0.4
  },
  {
   "v": "kostya",
   "t": "Но у тебя же дедушка умер.",
   "gap": 0.55
  },
  {
   "v": "narrator",
   "t": "'But your grandfather just passed away.' Kostya anchors this direct term in reply: \"dedushka\" means \"grandfather\", and it carries the main weight of what Kostya is saying.",
   "gap": 0.4
  },
  {
   "v": "vika",
   "t": "Да, знаете, я.",
   "gap": 0.55
  },
  {
   "v": "narrator",
   "t": "'Yes, you know, I...' Vika phrases this warning before Kostya: spoken Russian trims this down to just 3 words, dropping the extra helper words that English has to spell out.",
   "gap": 0.4
  },
  {
   "v": "kostya",
   "t": "Просто не до конца осознал.",
   "gap": 0.55
  },
  {
   "v": "narrator",
   "t": "'I just have not fully processed it yet.' Kostya holds firm firmly beside Vika, so Vika knows he is not just making small talk.",
   "gap": 0.4
  },
  {
   "v": "vika",
   "t": "Позвольте, я все-таки вернусь к работе.",
   "gap": 0.55
  },
  {
   "v": "narrator",
   "t": "'Allow me to get back to my work.' Vika points to this sharp expression for Kostya: \"pozvolte\" means \"allow me\" (from \"pozvolit\"), giving the line its exact edge.",
   "gap": 0.4
  },
  {
   "v": "kostya",
   "t": "Да, да, да, конечно.",
   "gap": 0.55
  },
  {
   "v": "narrator",
   "t": "'Yes, yes, of course.' Kostya sends the remark frankly here: spoken Russian trims this down to just 4 words, dropping the extra helper words that English has to spell out.",
   "gap": 0.4
  },
  {
   "v": "vika",
   "t": "Работай, Костя.",
   "gap": 0.55
  },
  {
   "v": "narrator",
   "t": "'Keep working, Kostya.' Vika fires back sharply on the spot, letting the remark speak for itself.",
   "gap": 0.4
  },
  {
   "v": "kostya",
   "t": "Но сейчас я точно знаю, что мне нужно.",
   "gap": 0.55
  },
  {
   "v": "narrator",
   "t": "'Right now I know for sure what I want.' Kostya picks this clear piece toward Vika: \"seychas\" means \"now\", and it carries the main weight of what Kostya is saying.",
   "gap": 0.4
  },
  {
   "v": "vika",
   "t": "Давай начнем все сначала.",
   "gap": 0.55
  },
  {
   "v": "narrator",
   "t": "'Let us start everything over from the beginning.' Vika makes this point frankly here: starting with \"davay\" is the classic everyday Russian way to say \"come on, let's do this\" between people on close terms.",
   "gap": 0.4
  },
  {
   "v": "kostya",
   "t": "Вот это я понимаю.",
   "gap": 0.55
  },
  {
   "v": "narrator",
   "t": "'Now that is what I like to hear.' Kostya counters earnestly before Vika, refusing to let the moment slip past.",
   "gap": 0.4
  },
  {
   "v": "vika",
   "t": "А ты не мог что-нибудь нормальное придумать?",
   "gap": 0.55
  },
  {
   "v": "narrator",
   "t": "'Could you not come up with something normal?' Vika frames one telling element in reply: \"normalnoye\" means \"normal\" (from \"normalnyy\"), giving the line its exact edge.",
   "gap": 0.4
  },
  {
   "v": "kostya",
   "t": "Нашел на чем шутить.",
   "gap": 0.55
  },
  {
   "v": "narrator",
   "t": "'What a thing to joke about.' Kostya brings the reaction before Vika: spoken Russian trims this down to just 4 words, dropping the extra helper words that English has to spell out.",
   "gap": 0.4
  },
  {
   "v": "vika",
   "t": "Главное, что все нормально прошло.",
   "gap": 0.55
  },
  {
   "v": "narrator",
   "t": "'The main thing is that everything went smoothly.' Vika answers lightly during the talk, so Kostya knows she is not just making small talk.",
   "gap": 0.9
  },
  {
   "v": "vika",
   "t": "А с чем?",
   "gap": 0.5
  },
  {
   "v": "kostya",
   "t": "Но у тебя же дедушка умер.",
   "gap": 0.5
  },
  {
   "v": "vika",
   "t": "Да, знаете, я.",
   "gap": 0.5
  },
  {
   "v": "kostya",
   "t": "Просто не до конца осознал.",
   "gap": 0.5
  },
  {
   "v": "vika",
   "t": "Позвольте, я все-таки вернусь к работе.",
   "gap": 0.5
  },
  {
   "v": "kostya",
   "t": "Да, да, да, конечно.",
   "gap": 0.5
  },
  {
   "v": "vika",
   "t": "Работай, Костя.",
   "gap": 0.5
  },
  {
   "v": "kostya",
   "t": "Но сейчас я точно знаю, что мне нужно.",
   "gap": 0.5
  },
  {
   "v": "vika",
   "t": "Давай начнем все сначала.",
   "gap": 0.5
  },
  {
   "v": "kostya",
   "t": "Вот это я понимаю.",
   "gap": 0.5
  },
  {
   "v": "vika",
   "t": "А ты не мог что-нибудь нормальное придумать?",
   "gap": 0.5
  },
  {
   "v": "kostya",
   "t": "Нашел на чем шутить.",
   "gap": 0.5
  },
  {
   "v": "vika",
   "t": "Главное, что все нормально прошло.",
   "gap": 0.9
  },
  {
   "v": "narrator",
   "t": "That wraps up this scene as vika offers her condolences to a bewildered Kostya at the bar, and then warmly tells Max she wants them to start over from the beginning. See you next time!",
   "gap": 0.5
  },
  {
   "v": "vika",
   "t": "Хорошего дня!",
   "gap": 0.3
  }
 ],
 "source": {
  "show": "Кухня (Kukhnya) S2.05",
  "file": "sources/kukhnya/s02/e05.ru.srt",
  "lines": [
   {
    "line": 0,
    "cue": 79,
    "fragment": "А с чем"
   },
   {
    "line": 1,
    "cue": 80,
    "fragment": "Но у тебя же дедушка умер"
   },
   {
    "line": 2,
    "cue": 81,
    "fragment": "Да, знаете, я"
   },
   {
    "line": 3,
    "cue": 82,
    "fragment": "просто не до конца осознал"
   },
   {
    "line": 4,
    "cue": 83,
    "fragment": "Позвольте, я все-таки вернусь к работе"
   },
   {
    "line": 5,
    "cue": 85,
    "fragment": "Да, да, да, конечно"
   },
   {
    "line": 6,
    "cue": 86,
    "fragment": "Работай, Костя"
   },
   {
    "line": 7,
    "cue": 88,
    "fragment": "Но сейчас я точно знаю, что мне нужно"
   },
   {
    "line": 8,
    "cue": 89,
    "fragment": "Давай начнем все сначала"
   },
   {
    "line": 9,
    "cue": 90,
    "fragment": "Вот это я понимаю"
   },
   {
    "line": 10,
    "cue": 94,
    "fragment": "А ты не мог что-нибудь нормальное придумать"
   },
   {
    "line": 11,
    "cue": 95,
    "fragment": "Нашел на чем шутить"
   },
   {
    "line": 12,
    "cue": 97,
    "fragment": "Главное, что все нормально прошло"
   }
  ]
 }
}
