{
 "schemaVersion": 1,
 "id": "kukhnya-s03e02-scene-01",
 "pair": "ru-en",
 "show": "kukhnya",
 "season": 3,
 "episode": 2,
 "scene": 1,
 "title": "Терпение официанта  (A Waiter's Patience)",
 "level": "A1 — Duolingo Section 2",
 "labels": {
  "guest": "Гость",
  "max": "Макс"
 },
 "segments": [
  {
   "v": "narrator",
   "t": "In Episode Two of Season Three, Max reflects on what quality matters most for a waiter at Claude Monet: not just manners or dramatic presentation, but endless patience with indecisive guests.",
   "gap": 0.8
  },
  {
   "v": "max",
   "t": "Что самое важное в работе официанта?",
   "gap": 0.55
  },
  {
   "v": "max",
   "t": "Манеры? Вежливость?",
   "gap": 0.55
  },
  {
   "v": "max",
   "t": "Эффектная подача блюд делает их вкуснее.",
   "gap": 0.55
  },
  {
   "v": "max",
   "t": "Индивидуальный подход?",
   "gap": 0.55
  },
  {
   "v": "guest",
   "t": "Так, это мне нельзя. Это тоже.",
   "gap": 0.55
  },
  {
   "v": "max",
   "t": "По-моему, главное — это терпение.",
   "gap": 0.55
  },
  {
   "v": "guest",
   "t": "Знаете что, дайте мне кофе.",
   "gap": 0.55
  },
  {
   "v": "guest",
   "t": "И всё.",
   "gap": 0.55
  },
  {
   "v": "max",
   "t": "Ты что делаешь? Заказал просто кофе!",
   "gap": 0.55
  },
  {
   "v": "guest",
   "t": "Кофе? Да, дайте мне кофе эспрессо.",
   "gap": 0.55
  },
  {
   "v": "guest",
   "t": "И вот, сдачи не надо.",
   "gap": 0.55
  },
  {
   "v": "max",
   "t": "Порой терпение очень щедро вознаграждается.",
   "gap": 0.9
  },
  {
   "v": "narrator",
   "t": "Now let's go back through their conversation line by line and unpack the Russian phrasing.",
   "gap": 0.4
  },
  {
   "v": "max",
   "t": "Что самое важное в работе официанта?",
   "gap": 0.55
  },
  {
   "v": "narrator",
   "t": "'What is the most important thing in a waiter's job?' Highlighting a waiter on the spot, Max puts the weight on \"ofitsianta\" (\"waiter\", from \"ofitsiant\") as the exchange unfolds.",
   "gap": 0.4
  },
  {
   "v": "max",
   "t": "Манеры? Вежливость?",
   "gap": 0.55
  },
  {
   "v": "narrator",
   "t": "'Manners? Politeness?' Dwelling on the politeness right here, Max keeps normal statement word order here, turning the line into a question for the guest purely through rising pitch.",
   "gap": 0.4
  },
  {
   "v": "max",
   "t": "Эффектная подача блюд делает их вкуснее.",
   "gap": 0.55
  },
  {
   "v": "narrator",
   "t": "'Spectacular presentation of dishes makes them tastier.' Max opens up firmly in this moment, bringing things back to earth after the buildup.",
   "gap": 0.4
  },
  {
   "v": "max",
   "t": "Индивидуальный подход?",
   "gap": 0.55
  },
  {
   "v": "narrator",
   "t": "'An individual approach?' Mentioning an individual approach before the guest, Max puts the emphasis on \"individualnyy\" (\"individual\") in the middle of the talk.",
   "gap": 0.4
  },
  {
   "v": "guest",
   "t": "Так, это мне нельзя. Это тоже.",
   "gap": 0.55
  },
  {
   "v": "narrator",
   "t": "'Right, I am not allowed to have this. This either.' Pushing back firmly before Max, the guest leans on \"nelzya\" (\"it is not allowed, one must not\"), which carries the whole predicate in Russian without needing \"it is\".",
   "gap": 0.4
  },
  {
   "v": "max",
   "t": "По-моему, главное — это терпение.",
   "gap": 0.55
  },
  {
   "v": "narrator",
   "t": "'In my opinion, the main thing is patience.' Max continues promptly in their talk, making his position completely clear.",
   "gap": 0.4
  },
  {
   "v": "guest",
   "t": "Знаете что, дайте мне кофе.",
   "gap": 0.55
  },
  {
   "v": "narrator",
   "t": "'You know what, give me a coffee.' Highlighting a coffee right here, the guest chooses \"kofe\" (\"of coffee\") so Max gets the point right away.",
   "gap": 0.4
  },
  {
   "v": "guest",
   "t": "И всё.",
   "gap": 0.55
  },
  {
   "v": "narrator",
   "t": "'And that is all.' Pressing on dryly beside Max, the guest links the Russian words directly in the present with no word for \"am\", \"is\", or \"are\" needed.",
   "gap": 0.4
  },
  {
   "v": "max",
   "t": "Ты что делаешь? Заказал просто кофе!",
   "gap": 0.55
  },
  {
   "v": "narrator",
   "t": "'What are you doing? He ordered just coffee!' Max tests calmly before the guest can change the subject.",
   "gap": 0.4
  },
  {
   "v": "guest",
   "t": "Кофе? Да, дайте мне кофе эспрессо.",
   "gap": 0.55
  },
  {
   "v": "narrator",
   "t": "'Coffee? Yes, give me an espresso coffee.' Touching on an espresso at once, the guest puts the emphasis on \"espresso\" (\"espresso\") in the middle of the talk.",
   "gap": 0.4
  },
  {
   "v": "guest",
   "t": "И вот, сдачи не надо.",
   "gap": 0.55
  },
  {
   "v": "narrator",
   "t": "'And here, keep the change.' Talking about the change during the talk, the guest leans on \"nado\" (\"it is necessary, one needs to\"), which carries the whole predicate in Russian without needing \"it is\".",
   "gap": 0.4
  },
  {
   "v": "max",
   "t": "Порой терпение очень щедро вознаграждается.",
   "gap": 0.55
  },
  {
   "v": "narrator",
   "t": "'Sometimes patience is very generously rewarded.' Max opens up bluntly with a nod, before the guest can change the subject.",
   "gap": 0.9
  },
  {
   "v": "max",
   "t": "Что самое важное в работе официанта?",
   "gap": 0.5
  },
  {
   "v": "max",
   "t": "Манеры? Вежливость?",
   "gap": 0.5
  },
  {
   "v": "max",
   "t": "Эффектная подача блюд делает их вкуснее.",
   "gap": 0.5
  },
  {
   "v": "max",
   "t": "Индивидуальный подход?",
   "gap": 0.5
  },
  {
   "v": "guest",
   "t": "Так, это мне нельзя. Это тоже.",
   "gap": 0.5
  },
  {
   "v": "max",
   "t": "По-моему, главное — это терпение.",
   "gap": 0.5
  },
  {
   "v": "guest",
   "t": "Знаете что, дайте мне кофе.",
   "gap": 0.5
  },
  {
   "v": "guest",
   "t": "И всё.",
   "gap": 0.5
  },
  {
   "v": "max",
   "t": "Ты что делаешь? Заказал просто кофе!",
   "gap": 0.5
  },
  {
   "v": "guest",
   "t": "Кофе? Да, дайте мне кофе эспрессо.",
   "gap": 0.5
  },
  {
   "v": "guest",
   "t": "И вот, сдачи не надо.",
   "gap": 0.5
  },
  {
   "v": "max",
   "t": "Порой терпение очень щедро вознаграждается.",
   "gap": 0.9
  },
  {
   "v": "narrator",
   "t": "And that finishes our opening scene. Listen for the contrast between the guest who orders a single coffee after ten minutes and the guest who leaves a generous tip. Until next time!",
   "gap": 0.5
  },
  {
   "v": "max",
   "t": "До завтра!",
   "gap": 0.3
  }
 ],
 "source": {
  "show": "Кухня (Kukhnya) S3.02",
  "file": "sources/kukhnya/s03/e02.ru.srt",
  "lines": [
   {
    "line": 0,
    "cue": 1,
    "fragment": "что самое важное в работе официанта"
   },
   {
    "line": 1,
    "cue": 2,
    "fragment": "Манеры"
   },
   {
    "line": 1,
    "cue": 3,
    "fragment": "Может быть"
   },
   {
    "line": 2,
    "cue": 4,
    "fragment": "эффектная подача блюд"
   },
   {
    "line": 2,
    "cue": 4,
    "fragment": "вкуснее"
   },
   {
    "line": 3,
    "cue": 5,
    "fragment": "Индивидуальный подход"
   },
   {
    "line": 4,
    "cue": 6,
    "fragment": "Так, это мне нельзя"
   },
   {
    "line": 4,
    "cue": 7,
    "fragment": "Это тоже"
   },
   {
    "line": 5,
    "cue": 8,
    "fragment": "По-моему, главное в работе официанта – это терпение"
   },
   {
    "line": 6,
    "cue": 9,
    "fragment": "Знаете что, дайте мне кофе"
   },
   {
    "line": 7,
    "cue": 10,
    "fragment": "И всё"
   },
   {
    "line": 8,
    "cue": 11,
    "fragment": "Ты что делаешь"
   },
   {
    "line": 8,
    "cue": 11,
    "fragment": "заказал просто кофе"
   },
   {
    "line": 9,
    "cue": 13,
    "fragment": "Кофе? Да, дайте мне кофе эспрессо"
   },
   {
    "line": 10,
    "cue": 14,
    "fragment": "И вот, сдачи не надо"
   },
   {
    "line": 11,
    "cue": 15,
    "fragment": "порой терпение в нашей работе очень щедро вознаграждается"
   }
  ]
 }
}
