{
 "schemaVersion": 1,
 "id": "kukhnya-s01e12-scene-05",
 "pair": "ru-en",
 "title": "Опасные конкуренты  (Dangerous Competitors)",
 "level": "A1 — Duolingo Section 2",
 "labels": {
  "barinov": "Шеф",
  "vika": "Вика"
 },
 "segments": [
  {
   "v": "narrator",
   "t": "Back in the dining room, Vika has found a leaflet for an Italian restaurant opening next door, and she shows it to Chef Barinov. She wants to change the menu, and he does not. Here is their argument in Russian first.",
   "gap": 0.8
  },
  {
   "v": "vika",
   "t": "Витя, посмотри на этот рекламный буклет!",
   "gap": 0.55
  },
  {
   "v": "barinov",
   "t": "Что это за странное слово Аркобалено?",
   "gap": 0.55
  },
  {
   "v": "barinov",
   "t": "Это вообще что, редкая болезнь почек?",
   "gap": 0.55
  },
  {
   "v": "vika",
   "t": "Аркобалено значит радуга по-итальянски, Витя.",
   "gap": 0.55
  },
  {
   "v": "barinov",
   "t": "Я не пойду в их кафе!",
   "gap": 0.55
  },
  {
   "v": "vika",
   "t": "Через неделю они открываются рядом с нами.",
   "gap": 0.55
  },
  {
   "v": "barinov",
   "t": "Ой, боюсь, кафе Радуга нас разорит!",
   "gap": 0.55
  },
  {
   "v": "vika",
   "t": "Витя, нам пора привлечь новых гостей.",
   "gap": 0.55
  },
  {
   "v": "vika",
   "t": "Нам нужно срочно поменять наше меню.",
   "gap": 0.55
  },
  {
   "v": "barinov",
   "t": "Мы лучшие, и нас любят за это!",
   "gap": 0.55
  },
  {
   "v": "vika",
   "t": "Ресторану нужны свежие и смелые идеи.",
   "gap": 0.55
  },
  {
   "v": "barinov",
   "t": "Меняй всё в зале, на своей территории!",
   "gap": 0.55
  },
  {
   "v": "barinov",
   "t": "А на кухню ко мне не лезь!",
   "gap": 0.9
  },
  {
   "v": "narrator",
   "t": "Let's take it a line at a time, and keep an eye on who is afraid of whom.",
   "gap": 0.4
  },
  {
   "v": "vika",
   "t": "Витя, посмотри на этот рекламный буклет!",
   "gap": 0.55
  },
  {
   "v": "narrator",
   "t": "'Vitya, look at this advertising leaflet!' 'Vitya' is a short, friendly form of Viktor, and very few people dare to use it. 'Reklamny' is just 'reklama', 'advert', with a new ending, and 'buklet' is 'booklet' with a Russian accent.",
   "gap": 0.4
  },
  {
   "v": "barinov",
   "t": "Что это за странное слово Аркобалено?",
   "gap": 0.55
  },
  {
   "v": "narrator",
   "t": "'What kind of strange word is Arcobaleno?' 'What kind of' is literally 'what this for'. 'Slovo' is the word for 'word',.",
   "gap": 0.4
  },
  {
   "v": "barinov",
   "t": "Это вообще что, редкая болезнь почек?",
   "gap": 0.55
  },
  {
   "v": "narrator",
   "t": "'What is that anyway, a rare kidney disease?' 'Vobshche' means 'in general' and 'at all', and Russians put it everywhere. 'Rare' and 'illness' match in gender, and 'of kidneys' is a single word.",
   "gap": 0.4
  },
  {
   "v": "vika",
   "t": "Аркобалено значит радуга по-итальянски, Витя.",
   "gap": 0.55
  },
  {
   "v": "narrator",
   "t": "'Arcobaleno means rainbow in Italian, Vitya.' 'Znachit' means 'means', and it's also a filler like 'so' in speech. 'In Italian' is one word: 'po' at the front and 'ski' at the back make 'in that language'.",
   "gap": 0.4
  },
  {
   "v": "barinov",
   "t": "Я не пойду в их кафе!",
   "gap": 0.55
  },
  {
   "v": "narrator",
   "t": "'I will not go to their cafe!' 'Ikh' means 'their' and never changes, whatever it describes. 'Cafe' doesn't change either.",
   "gap": 0.4
  },
  {
   "v": "vika",
   "t": "Через неделю они открываются рядом с нами.",
   "gap": 0.55
  },
  {
   "v": "narrator",
   "t": "'In a week they are opening right next to us.' 'Through a week' is how Russians say 'in a week'. 'They open' ends in 'sya', which is literally 'they open themselves'.",
   "gap": 0.4
  },
  {
   "v": "barinov",
   "t": "Ой, боюсь, кафе Радуга нас разорит!",
   "gap": 0.55
  },
  {
   "v": "narrator",
   "t": "'Oh, I am scared, cafe Rainbow will ruin us!' Barinov uses the Russian word for 'rainbow', the translation of 'Arcobaleno', as an insult. 'I am scared' is a single word, 'boyus'.",
   "gap": 0.4
  },
  {
   "v": "vika",
   "t": "Витя, нам пора привлечь новых гостей.",
   "gap": 0.55
  },
  {
   "v": "narrator",
   "t": "'Vitya, it is time for us to attract new guests.' 'Nam pora' is literally 'to us time', which is how Russians say 'it's time for us'. 'New' and 'guests' both end in 'kh' here.",
   "gap": 0.4
  },
  {
   "v": "vika",
   "t": "Нам нужно срочно поменять наше меню.",
   "gap": 0.55
  },
  {
   "v": "narrator",
   "t": "'We need to urgently change our menu.' 'Nuzhno' means 'necessary', and the action word follows it. 'Menyu' doesn't change shape, just like 'cafe'.",
   "gap": 0.4
  },
  {
   "v": "barinov",
   "t": "Мы лучшие, и нас любят за это!",
   "gap": 0.55
  },
  {
   "v": "narrator",
   "t": "'We are the best, and people love us for that!' Nobody says 'they' here. The bare word 'love', in its 'they' form, means 'people in general'. Russian does that a lot when nobody in particular is meant.",
   "gap": 0.4
  },
  {
   "v": "vika",
   "t": "Ресторану нужны свежие и смелые идеи.",
   "gap": 0.55
  },
  {
   "v": "narrator",
   "t": "'The restaurant needs fresh and bold ideas.' 'Restoranu' ends in 'u' because the restaurant is the one in need, so it's 'to the restaurant needed ideas'. 'Bold' and 'fresh' both end in 'e' because 'ideas' is a group.",
   "gap": 0.4
  },
  {
   "v": "barinov",
   "t": "Меняй всё в зале, на своей территории!",
   "gap": 0.55
  },
  {
   "v": "narrator",
   "t": "'Change everything in the dining room, on your own territory!' 'Menyay' is the order 'change'. 'Zal' means a hall, and after 'in' it turns into 'v zale'. 'Svoey' is 'your own' again.",
   "gap": 0.4
  },
  {
   "v": "barinov",
   "t": "А на кухню ко мне не лезь!",
   "gap": 0.55
  },
  {
   "v": "narrator",
   "t": "'And do not get into my kitchen!' 'Ne lez' is the rude, informal way of saying 'stay out', literally 'don't climb'. 'Ko mne' is 'to me', with an extra 'o' to make it easier to say. Now let's listen to the whole conversation again from start to finish.",
   "gap": 0.9
  },
  {
   "v": "vika",
   "t": "Витя, посмотри на этот рекламный буклет!",
   "gap": 0.5
  },
  {
   "v": "barinov",
   "t": "Что это за странное слово Аркобалено?",
   "gap": 0.5
  },
  {
   "v": "barinov",
   "t": "Это вообще что, редкая болезнь почек?",
   "gap": 0.5
  },
  {
   "v": "vika",
   "t": "Аркобалено значит радуга по-итальянски, Витя.",
   "gap": 0.5
  },
  {
   "v": "barinov",
   "t": "Я не пойду в их кафе!",
   "gap": 0.5
  },
  {
   "v": "vika",
   "t": "Через неделю они открываются рядом с нами.",
   "gap": 0.5
  },
  {
   "v": "barinov",
   "t": "Ой, боюсь, кафе Радуга нас разорит!",
   "gap": 0.5
  },
  {
   "v": "vika",
   "t": "Витя, нам пора привлечь новых гостей.",
   "gap": 0.5
  },
  {
   "v": "vika",
   "t": "Нам нужно срочно поменять наше меню.",
   "gap": 0.5
  },
  {
   "v": "barinov",
   "t": "Мы лучшие, и нас любят за это!",
   "gap": 0.5
  },
  {
   "v": "vika",
   "t": "Ресторану нужны свежие и смелые идеи.",
   "gap": 0.5
  },
  {
   "v": "barinov",
   "t": "Меняй всё в зале, на своей территории!",
   "gap": 0.5
  },
  {
   "v": "barinov",
   "t": "А на кухню ко мне не лезь!",
   "gap": 0.9
  },
  {
   "v": "narrator",
   "t": "Barinov stomps off, and Vika is left with a leaflet and a problem. When you watch, count how often he says 'my' about the kitchen.",
   "gap": 0.5
  },
  {
   "v": "barinov",
   "t": "Пока!",
   "gap": 0.3
  }
 ],
 "source": {
  "show": "Кухня (Kukhnya) S1.12",
  "file": "sources/kukhnya/s01/e12.ru.dual.srt",
  "lines": [
   {
    "line": 0,
    "cue": 41,
    "fragment": "Полюбуйся."
   },
   {
    "line": 1,
    "cue": 42,
    "fragment": "ресторана Аркобалена."
   },
   {
    "line": 2,
    "cue": 45,
    "fragment": "Это вообще что, болезнь почек?"
   },
   {
    "line": 3,
    "cue": 46,
    "fragment": "Аркабалена – это радуга по-итальянски."
   },
   {
    "line": 4,
    "cue": 43,
    "fragment": "я к ним не приду."
   },
   {
    "line": 5,
    "cue": 48,
    "fragment": "У нас под боком через неделю открываются конкуренты."
   },
   {
    "line": 6,
    "cue": 49,
    "fragment": "Боюсь, боюсь. Кафе «Радуга» разорит нас."
   },
   {
    "line": 7,
    "cue": 54,
    "fragment": "Нам нужно привлечь людей чем-то новым."
   },
   {
    "line": 8,
    "cue": 55,
    "fragment": "Меню поменять."
   },
   {
    "line": 9,
    "cue": 55,
    "fragment": "Мы такие, какие есть, и за это нас любят."
   },
   {
    "line": 11,
    "cue": 56,
    "fragment": "меняй на своей территории, в зале."
   },
   {
    "line": 12,
    "cue": 57,
    "fragment": "А ко мне на кухню не лезь."
   }
  ]
 },
 "show": "kukhnya",
 "season": 1,
 "episode": 12,
 "scene": 5
}
